Sheet: LiveTable-Generator
A1: a | B1: b | C1: c
A2: of:=RAND() -> 0.866951008399388 | B2: of:=RAND() -> 0.480552099084865 | C2: of:=[.B2]+[.A2] -> 1.34750310748425
A3: of:=RAND() -> 0.539565961349912 | B3: of:=RAND() -> 0.423982999745877 | C3: of:=[.B3]+[.A3] -> 0.963548961095789
A4: of:=RAND() -> 0.49838227120002 | B4: of:=RAND() -> 0.445632934599051 | C4: of:=[.B4]+[.A4] -> 0.944015205799071
A5: of:=RAND() -> 0.659181902234581 | B5: of:=RAND() -> 0.594481288765707 | C5: of:=[.B5]+[.A5] -> 1.25366319100029
A6: of:=RAND() -> 0.131342807208133 | B6: of:=RAND() -> 0.552276532222092 | C6: of:=[.B6]+[.A6] -> 0.683619339430225

Sheet: TableInstance
A1: a | B1: b | C1: c
A2: 0.235893245701929 | B2: 0.9524521817428 | C2: 1.18834542744473
A3: 0.546774918553411 | B3: 0.788265262161408 | C3: 1.33504018071482
A4: 0.646369503124988 | B4: 0.304259589572205 | C4: 0.950629092697193
A5: 0.565336387810686 | B5: 0.917155592684752 | C5: 1.48249198049544
A6: 0.587914661318644 | B6: 0.374578678366622 | C6: 0.962493339685266